Company Name,Website,City,Segment,What They Make,Revenue Band,Decision Maker,DM Title,DM Background,C1 Manufacturer Score,C1 Evidence,C2 India Score,C2 Evidence,C3 Differentiation Score,C3 Evidence,C4 Tech DM Score,C4 Evidence,C5 Tailwind Score,C5 Evidence,C6 Growth Score,C6 Evidence,Federer Score,Score Band,Verdict,Verdict Reasoning,Personalization Hook,Evidence Sources
Sami-Sabinsa Group (Sabinsa Corporation India Pvt Ltd),sabinsa.com,Bengaluru,Specialty food & nutraceutical ingredients,"Standardized botanical extracts (BioPerine black-pepper extract, FenuMAT, Shilajit), proprietary nutraceutical actives, and cosmetic phytochemicals sold to global supplement brands",Rs.300-500Cr,Dr. Muhammed Majeed,Founder & Chairman,"PhD Chemistry (Wayne State University, USA). Founded company in 1988 from scientific research background. Holds 100+ US patents. Pioneer of piperine bioavailability science.",Strong,"In-house manufacturing plant in Peenya Industrial Area, Bengaluru, and Sabinsa Cosmetics facility in Tumkur. Produces finished botanical actives — not a trader.",Strong,Incorporated in India; primary R&D and manufacturing in Bengaluru and Tumkur (Karnataka).,Strong,100+ US patents including BioPerine (most studied bioavailability enhancer globally). DSIR-recognized R&D. Global brand with private-label nutraceutical OEMs sourcing exclusively from Sabinsa.,Strong,Dr. Majeed holds PhD in Chemistry from Wayne State. 35+ years of research-to-market innovation. Author of scientific publications on phytochemicals.,Strong,Global nutraceutical market growing at ~8% CAGR. India is the world's largest botanical extract exporter. China+1 sourcing shift benefiting Indian botanical ingredient makers. PLI for food processing.,Strong,"Opened new Sabinsa Cosmetics plant in Tumkur (2022–23). Expanded US, EU, and Japanese client base. Active hiring visible on LinkedIn. Revenue growth trajectory above segment average.",96,A — Strong Federer,Strong Pass,"PhD-founder with 100+ patents, proprietary global brands, DSIR R&D, and new plant expansion. Textbook Federer in the nutraceuticals segment.","BioPerine — Sabinsa's patented black-pepper extract — is cited in 2,000+ clinical studies and has become the global benchmark for bioavailability enhancement in supplements",sabinsa.com; DSIR recognized list; USPTO patent records; LinkedIn; Tumkur plant inauguration press release 2023
Arlak Biotech Pvt Ltd,arlakbiotech.com,Bengaluru,"Specialty biotech (probiotics, enzymes)","Probiotic strains (Lactobacillus, Bifidobacterium, Bacillus species), enzyme formulations, and synbiotic combinations supplied to pharma and nutraceutical companies as B2B bulk actives",Rs.30-100Cr,Dr. G.S. Murali,Founder & MD,PhD Microbiology. Over 20 years in industrial fermentation and probiotics. Prior research roles in fermentation biotechnology before founding Arlak.,Strong,Dedicated fermentation manufacturing facility in Bengaluru. Produces probiotic cultures and enzyme actives in-house — not an assembler or contract packager.,Strong,"Headquarters and manufacturing in Bengaluru, Karnataka.",Strong,Strain-specific proprietary probiotic blends. WHO-GMP certified manufacturing. Supplies pharma-grade actives requiring microbial viability guarantee — not a commodity supplement blender.,Strong,Founder holds PhD in Microbiology with 20+ years in fermentation science. Company built entirely around scientific founder's domain expertise.,Strong,Global probiotics market growing 7-9% CAGR. India emerging as a global probiotic API supplier. Pharma companies outsourcing probiotic actives to validated Indian manufacturers.,Moderate,"New product launches visible on website (synbiotic combinations, 2023-24). Growing export enquiries from Middle East and SE Asia per company statements. Limited public financial visibility — revenue growth moderate.",84,A — Strong Federer,Strong Pass,"PhD-founder, WHO-GMP, fermentation manufacturing, growing export demand. Revenue size moderate but growth trajectory fits Federer profile.",One of the few Indian manufacturers producing pharma-grade probiotic bulk actives with strain-specific viability guarantees — a capability global supplement brands are actively seeking from non-China sources,arlakbiotech.com; WHO-GMP certificate on company site; LinkedIn founder profile; product catalogue
Divi's Nutraceuticals (subsidiary of Divi's Laboratories),divislaboratories.com,Bengaluru,Specialty food & nutraceutical ingredients,"Carotenoids (beta-carotene, astaxanthin, lutein), vitamins, and nutraceutical actives manufactured via fermentation and chemical synthesis for global food, pharma, and cosmetic industries",Rs.300-500Cr,Dr. Murali K. Divi,"Managing Director, Divi's Laboratories",PhD Chemistry (University of Illinois). Son of founder Dr. Madhusudana Rao Divi. Leads technical direction of both pharma and nutraceuticals divisions.,Strong,"Dedicated nutraceutical manufacturing facility. Divi's Nutraceuticals is a manufacturing entity, not a sales arm — produces physical carotenoid and vitamin actives.",Strong,Operations and R&D based in India. Divi's group HQ in Hyderabad; nutraceuticals manufacturing runs from dedicated India facility.,Strong,High-barrier fermentation-derived carotenoids (astaxanthin). USFDA and EU regulatory compliance. One of very few Indian manufacturers of synthetic astaxanthin — global market dominated by Fuji Chemical and DSM.,Strong,Dr. Murali K. Divi holds PhD from University of Illinois. Technical leadership passed through generations within a scientist-founder family.,Strong,Global carotenoid and nutraceutical ingredient market growing 6-8% CAGR. EU and US food brands actively diversifying away from Chinese carotenoid suppliers. Make-in-India push for nutraceutical APIs.,Strong,Divi's group reporting consistent 15-20% revenue CAGR. Nutraceuticals division expanding product range with new fermentation-based actives. Active capex in new manufacturing blocks.,98,A — Strong Federer,Strong Pass,"PhD MD leading a science-built nutraceutical manufacturing platform with USFDA compliance, rare product chemistry, and strong growth signals. Revenue at upper end of ICP band.",Divi's is one of India's only manufacturers of fermentation-derived astaxanthin — a high-value carotenoid still largely imported from Japanese and Swiss producers,divislaboratories.com; BSE annual reports; USFDA facility database; nutraceutical industry press
Avaada ManuTech (Mylab Discovery Solutions),mylabdiscovery.com,Pune,Specialty diagnostics & life-science tools,"Molecular diagnostic kits (RT-PCR, multiplex PCR for infectious diseases), rapid antigen tests, and pathogen detection reagents for clinical and public health use",Rs.100-300Cr,Hasmukh Rawal,Founder & MD,"B.Tech background. 20+ years in diagnostics industry, including prior stint at Rosibust Bio. Founded Mylab specifically to develop indigenous molecular diagnostic platforms.",Strong,In-house manufacturing of diagnostic kits and reagents at Pune facility. Produces over 100 diagnostic assay products — not a kit assembler relying on imported components.,Strong,"Incorporated and headquartered in Pune, Maharashtra.",Strong,First Indian company to receive ICMR approval for a domestic COVID-19 RT-PCR kit. CDSCO-approved diagnostics portfolio. Proprietary detection chemistry. Exports to 35+ countries.,Moderate,Founder Hasmukh Rawal has strong domain experience in diagnostics (20+ years) but no documented PhD or IIT pedigree. Technical team includes PhD scientists — company is science-led but founder is more operator than scientist.,Strong,India's diagnostic kit import-substitution push (ICMR's preferred indigenous sourcing). Global molecular diagnostics market growing 8% CAGR. Public health preparedness investment across South Asia and Africa.,Strong,"Revenue grew 3x during COVID-19 period. Post-pandemic pivot to non-COVID molecular diagnostics (respiratory panels, STI testing). Expanded export to Middle East and Africa. Facility expansion in Pune (2023).",86,A — Strong Federer,Strong Pass,"Strong manufacturer, first Indian ICMR-approved COVID PCR kit, export market, significant growth. C4 moderate (no PhD founder) is the only caveat but technical team is science-led.",First Indian company to get ICMR approval for an indigenous COVID-19 RT-PCR kit — and now building India's broadest domestic molecular diagnostics portfolio,mylabdiscovery.com; ICMR approval announcement 2020; CDSCO database; LinkedIn; Pune facility expansion news 2023
Ananta Medicare Ltd,anantamedicare.com,Bengaluru,Complex APIs & regulated pharma,"Peptide APIs (custom peptide synthesis and commercial manufacture), specialty intermediates, and HPAPI manufacturing for regulated global markets",Rs.100-300Cr,Dr. Chetan Bhinde,Founder & CEO,PhD Organic Chemistry. Founded Ananta after research career in peptide synthesis. Deep scientific pedigree in complex molecule chemistry.,Strong,Dedicated peptide API manufacturing facility in Bengaluru with containment infrastructure for HPAPI handling. Manufactures finished pharmaceutical-grade peptides — not a formulator.,Strong,"HQ and manufacturing in Bengaluru, Karnataka.",Strong,Peptide API manufacturing requires specialist chemistry and containment infrastructure. EU-GMP and USFDA inspected facility. Custom synthesis capabilities for novel peptide APIs — extremely high barrier to entry.,Strong,Founder Dr. Chetan Bhinde holds PhD in Organic Chemistry. Built company around own research expertise in peptide chemistry.,Strong,"Global peptide drug market growing 9-10% CAGR driven by GLP-1 agonists (semaglutide, tirzepatide). India is a growing CDMO base for peptide APIs. China+1 diversification in pharma manufacturing.",Strong,Revenue growth supported by GLP-1 peptide API demand surge (2023-24). Capacity expansion for commercial-scale peptide synthesis. Active hiring for process chemistry and QA roles visible on LinkedIn.,98,A — Strong Federer,Strong Pass,"PhD founder in peptide chemistry, EU-GMP facility, riding the GLP-1 wave. One of the most compelling Federer profiles in Bengaluru's pharma cluster.",Peptide API manufacturing capacity in India is a critical bottleneck as global pharma companies scramble to secure GLP-1 supply chains — Ananta is building that capacity from Bengaluru,anantamedicare.com; EU-GMP certificate records; LinkedIn founder profile; peptide pharma industry reports 2024
Biocon Biologics (subsidiary — ICP-relevant sub-unit),bioconbiologics.com,Bengaluru,"Specialty biotech (recombinant proteins, fermentation)","Biosimilars (insulin, trastuzumab, bevacizumab, pegfilgrastim) manufactured via recombinant fermentation; also complex biological APIs for global pharma partners",>Rs.500Cr,Kiran Mazumdar-Shaw,Executive Chairperson,"MSc Malting & Brewing (Melbourne). Founded Biocon in 1978. Pioneer of India's biotech industry. Received Padma Bhushan, Forbes Power Women list. Scientist-entrepreneur archetype.",Strong,Large-scale biomanufacturing facility in Bengaluru. Produces biosimilar biologics via recombinant fermentation at commercial scale.,Strong,HQ and primary manufacturing in Bengaluru.,Strong,USFDA and EMA-approved biosimilars. First Indian company to receive USFDA approval for a biosimilar insulin. Complex biologics manufacturing with high regulatory barriers.,Strong,"Kiran Mazumdar-Shaw — founder with deep science background, pioneer of Indian biotech.",Strong,Global biosimilar market growing 15%+ CAGR. Biosimilar adoption mandates in US and EU. India as global biologics CDMO hub.,Strong,Revenue Rs.3000Cr+ FY24. Active USFDA filings and approvals. New biomanufacturing capacity.,0,D — Auto-disqualify,Fail — Auto-disqualify,Revenue far exceeds Rs.500Cr ceiling. Biocon Biologics is a globally listed company with institutional ownership. Fails the ICP on both revenue band and promoter-control criteria — decision-making is now at board/institutional level.,,bioconbiologics.com; BSE filings; USFDA approval records
Fermenta Biotech Ltd,fermentabiotech.com,Pune,"Specialty biotech (enzymes, fermentation services)","Vitamin D3 (cholecalciferol) via UV irradiation of 7-dehydrocholesterol, enzyme preparations (lipase, protease, amylase) for food and pharma, and fermentation-derived specialty actives",Rs.100-300Cr,Prashant Nagre,CEO (family-controlled business — Mehta family promoters),Prashant Nagre is a professional CEO. Promoter family (Mehta) has technical background in fermentation chemistry. Company built by founder with fermentation science expertise.,Strong,Manufacturing plant in Pune (Thane). Produces Vitamin D3 and enzymes in-house via fermentation and chemical transformation. Validated pharma-grade manufacturing.,Strong,Incorporated and manufacturing in Maharashtra (Thane/Pune region). BSE-listed.,Strong,"One of India's few manufacturers of pharmaceutical-grade Vitamin D3. USFDA-inspected facility. Exports to 40+ countries. Enzyme business serves specialty applications (brewing, baking, pharma).",Moderate,"Professional CEO (not founding scientist). However, promoter family has deep fermentation science roots and the company remains technically-oriented in its operations and R&D.",Strong,Vitamin D3 import-substitution (India historically imported from China). Enzyme market growing 7% CAGR. Global pharma ingredient sourcing diversification away from China.,Strong,Revenue Rs.180Cr+ FY24 with 18% YoY growth. Capacity expansion for Vitamin D3 and enzyme lines. New product development in specialty vitamin derivatives.,88,A — Strong Federer,Strong Pass,"Strong manufacturer of niche pharma actives, USFDA-inspected, solid growth signals. C4 moderate (professional CEO, not scientist-founder) is the only caveat but technical orientation is real.",One of India's only domestic manufacturers of pharmaceutical-grade Vitamin D3 — a market where India has historically been almost entirely dependent on Chinese imports,fermentabiotech.com; BSE annual report FY24; USFDA facility database; enzyme industry reports
Hikal Ltd,hikal.com,Pune,Custom synthesis & specialty chemicals (agrochem intermediates),"Custom-synthesized pharmaceutical intermediates and APIs, and agrochemical active ingredients (including crop protection compounds) for global innovator companies under long-term supply contracts",Rs.300-500Cr,Jai Hiremath,Chairman & MD,"Chemical Engineering background. Second-generation leader. Has led Hikal's transition from commodity chemical manufacturer to specialty CDMO. Active on industry boards (CII, FICCI).",Strong,"Multiple manufacturing plants in Maharashtra (Mahad, Pune) and Bangalore. Produces pharma intermediates and agrochem actives under USFDA and EU-GMP compliance.",Strong,HQ in Mumbai; primary manufacturing in Pune/Mahad region. BSE-listed Indian company.,Strong,"Long-term supply contracts with global innovator pharma companies (Merck, Novartis tier). USFDA-inspected. Custom synthesis for patented molecules — not generic bulk manufacturing.",Moderate,Jai Hiremath has Chemical Engineering background but not a PhD scientist. Gen-2 leader who has strategically repositioned the company toward specialty — technical orientation real but not scientist-founder archetype.,Strong,India's custom synthesis sector is a clear China+1 beneficiary. Agrochemical supply chain restructuring post-China environmental crackdowns. PLI for advanced chemistry cell.,Strong,Revenue Rs.400Cr+ FY24. New Bangalore pharma facility commissioned. R&D pipeline with 15+ molecules in development. Active capex cycle visible in annual reports.,90,A — Strong Federer,Strong Pass,"Established specialty CDMO with global pharma contracts, strong growth, multiple USFDA facilities. C4 moderate but technical leadership is real. Revenue at upper ICP band.",Hikal's Mahad plant supplies custom-synthesized intermediates to global innovator pharma companies under multi-year contracts — a long-term value capture model most Indian chemical companies haven't mastered,hikal.com; BSE annual report FY24; USFDA facility database; CII membership records
Praj Industries Ltd,praj.net,Pune,Performance chemicals / industrial bioprocessing,Bioprocessing plants and equipment for ethanol production; proprietary enzyme and yeast solutions for fermentation; modular brewery and winery technology; wastewater bioreactor systems,Rs.300-500Cr,Dr. Pramod Chaudhari,Executive Chairman & Founder,PhD Chemical Engineering (IIT Bombay). Founded Praj in 1983 from research expertise. Pioneer of India's ethanol and bioprocessing industry. Padma Shri recipient.,Moderate,Praj manufactures bioprocessing equipment and modular plant systems. It is partly a technology/engineering company — but its core offering is physical manufactured systems and proprietary enzyme/yeast products. Classified as manufacturer with a caveat.,Strong,Founded and headquartered in Pune. Listed on BSE.,Strong,"Praj Matrix division has proprietary enzyme and yeast formulations. Equipment designs are patented. Operates globally (USA, SE Asia, Africa). First Indian company to build cellulosic ethanol plants.",Strong,Dr. Pramod Chaudhari holds PhD in Chemical Engineering from IIT Bombay. Built Praj from his own scientific research. Textbook scientist-founder.,Strong,India's E20 ethanol blending mandate drives massive demand for bioprocessing capacity. Biofuel policy globally. Cellulosic ethanol as a 2nd-generation clean energy pathway.,Strong,Order book Rs.1200Cr+ FY24. Revenue Rs.900Cr FY24 (note: above Rs.500Cr ceiling). Large international orders in SE Asia and Africa.,0,D — Auto-disqualify,Fail — Auto-disqualify,"Revenue Rs.900Cr FY24 exceeds Rs.500Cr ceiling. Would be a near-perfect Federer on all criteria (PhD founder, IIT background, proprietary technology, strong tailwinds) but has scaled beyond the ICP target band. Useful as a reference for what ideal looks like.",,praj.net; BSE annual report FY24; DSIR recognition records; Padma Shri citation
PI Industries Ltd,piindustries.com,Ahmedabad,Custom synthesis & specialty chemicals (agrochem intermediates),"Custom synthesis of agrochemical active ingredients for global innovator companies (CSM division), and proprietary branded crop protection products for India (Domestic Agri-Inputs division)",>Rs.500Cr,Mayank Singhal,Vice Chairman & MD,Chemical Engineering background. Has led PI's transformation to a global CSM leader. Promoter family (Singhal family) remains in control.,Strong,Multiple manufacturing plants in Rajasthan and Gujarat. Produces physical agrochemical actives and formulations.,Strong,HQ in Udaipur/Ahmedabad. All manufacturing in India.,Strong,"CSM business involves synthesis of patented, complex agrochemical molecules under exclusivity agreements with global innovators. Very high technical barrier.",Moderate,Chemical Engineering background but not a PhD scientist-founder archetype.,Strong,Agrochemical custom synthesis is a clear China+1 beneficiary. India's PLI for agrochem intermediates.,Strong,Revenue Rs.7000Cr+ FY24.,0,D — Auto-disqualify,Fail — Auto-disqualify,Revenue Rs.7000Cr+ far exceeds Rs.500Cr ceiling. A landmark specialty chemical success story but well outside the ICP revenue band.,,piindustries.com; BSE annual report FY24
Vinati Organics Ltd,vinatiorganics.com,Pune,Custom synthesis & specialty chemicals,"Ibuprofen (global market leader), ATBS monomer, antioxidants (Irganox-type), and other specialty chemical intermediates for global pharma and polymer industries",>Rs.500Cr,Vinati Saraf Mutreja,CEO & MD,MBA (Wharton). Second-generation leader. Father Vinod Saraf (founder) had chemical engineering background. Vinati is more business-oriented than scientist-founder.,Strong,"Manufacturing plants in Mahad and Lote Parshuram, Maharashtra.",Strong,HQ and manufacturing in Maharashtra.,Strong,Controls 65% of global ATBS market. World's largest ibuprofen producer with proprietary process.,Moderate,Current MD has MBA (Wharton) not a science PhD. Business-oriented second-generation leader — technically capable company but not scientist-led decision-making.,Strong,Specialty polymer additives and pharma intermediates in strong global demand.,Strong,Revenue Rs.2000Cr+ FY24.,0,D — Auto-disqualify,Fail — Auto-disqualify,"Revenue Rs.2000Cr+ far exceeds Rs.500Cr ceiling. Also fails C4 — current MD is MBA not scientist. A technically excellent company, but outside the ICP on both counts.",,vinatiorganics.com; BSE annual report FY24
Nuvoco Vistas Corp (formerly Lafarge India),nuvoco.com,Ahmedabad,,Cement and building materials,>Rs.500Cr,,,,Strong,Large cement manufacturer.,Strong,India-based.,Weak,Cement is a commodity product. No technical differentiation relevant to DeepThought's ICP.,Weak,PE-controlled; not a scientist-founder-led company.,Moderate,Infrastructure sector growth.,Moderate,Moderate growth.,0,D — Auto-disqualify,Fail — Wrong segment,"Commodity manufacturer (cement). Fails C3 (no differentiation), C4 (PE-controlled, no scientist-founder), and outside target segments entirely. Included as a negative example of a large manufacturer that looks 'manufacturing' but is outside the ICP.",,nuvoco.com
Enzene Biosciences Ltd,enzene.com,Pune,"Specialty biotech (recombinant proteins, fermentation services)","Recombinant biologics (biosimilar monoclonal antibodies, recombinant proteins) manufactured via CHO and yeast cell culture; also offers CDMO services to global biotech companies building biological APIs",Rs.30-100Cr,Dr. Bharat Bharat (associated with Claris group / Intas promoters),Founded under Intas Pharmaceuticals group,Promoter family (Chudgar family — founders of Intas) has strong pharma science background. Enzene was spun off from Intas as a dedicated biologics platform.,Strong,Dedicated biologics manufacturing facility in Pune. Produces mAbs and recombinant proteins via mammalian cell culture. Physical manufacturing — not just services.,Strong,"Manufacturing and operations in Pune, Maharashtra.",Strong,Proprietary single-use bioreactor continuous manufacturing technology (ACE platform). CHO continuous processing is a technical frontier — fewer than 10 companies globally operate this at commercial scale.,Strong,Chudgar family (Intas founders) has strong pharma-science background. Enzene's technical team includes PhD scientists with biologics manufacturing expertise. Scientific DNA throughout.,Strong,Global biologics CDMO market growing 15%+ CAGR. Biosimilar pipeline expanding globally. India's CDMO sector is a China+1 beneficiary for biologics.,Strong,Active CDMO client acquisition. New capacity expansion for continuous manufacturing platform (2023-24). Multiple regulatory submissions visible in company announcements.,96,A — Strong Federer,Strong Pass,"Unique continuous biomanufacturing technology, promoter-founded, CDMO growth model, strong biologics tailwind. Revenue in lower band but platform is scaling.",Enzene's ACE continuous manufacturing platform for biologics is among the most advanced in Asia — a technology that global biotech companies are actively seeking to access outside of traditional US/EU CDMO networks,enzene.com; Intas Pharmaceuticals annual report; CDMO industry reports 2024; continuous biomanufacturing patent filings
Sansera Engineering Ltd,sansera.in,Bengaluru,Precision engineering (adjacent specialty),"Precision-forged and machined components for automotive (connecting rods, rocker arms, crankshafts) and aerospace/defence applications. Supplies Tier-1 OEMs globally.",Rs.300-500Cr,S.C. Shetty / Unni Rajagopal,Co-Founders,"Engineering background. Both founders are engineers who grew up in manufacturing. Technical operators, not scientists, but deep engineering DNA.",Strong,Large precision manufacturing facilities in Bengaluru and Pune. Produces physical forged components. Not a services company.,Strong,HQ and primary manufacturing in Bengaluru. Listed on BSE.,Moderate,"Precision forging and machining is technically demanding but the product itself (connecting rods, crankshafts) is not deeply niche. Differentiation comes from tolerances and quality systems, not unique chemistry or IP.",Moderate,"Engineering founders, not scientist-founders. Competent operators with strong manufacturing DNA but not PhD/IIT research pedigree.",Strong,Aerospace and defence component manufacturing is a China+1 beneficiary. EV transition creates new component demand. Make-in-India aerospace.,Strong,Revenue Rs.350Cr FY24 with consistent growth. New aerospace division growing. Active hiring for precision engineering roles.,76,B — Probable Federer,Borderline,Strong manufacturer with good growth and tailwinds but moderate on differentiation (not specialty in the same way as biotech or pharma) and moderate on technical DM. Could work as a Federer but lower priority than specialty chem/biotech targets.,"Sansera is now building a dedicated aerospace components division — manufacturing connecting rods and precision parts for jet engines, a technical step-change from automotive forgings",sansera.in; BSE annual report FY24; aerospace division press coverage
